{
    "export_packet_id": "EK:first_run:v1",
    "kernel_contract_version": "v0.1",
    "source_run_id": "first_run",
    "source_csv_path": "Transformer/LanguageKernel/outputs/source.first_run.csv",
    "source_csv_sha256": "CD7AEB4132E0719DF203218DE623C56D47278590854B424407ADF7747B134D73",
    "declared_lens": "medium FFT / Hann baseline",
    "support_tier": "RETAINED_ONLY",
    "query_class": "Q3",
    "claim_class_ceiling": "L1",
    "legal_posture": "Read-side Language Kernel export only. No canon authority. Not structural truth. Not primary retention substance.",
    "allowed_uses": [
        "support_review",
        "reasoning_overlay_benchmark"
    ],
    "non_claims": [
        "not canon",
        "not source restoration",
        "not identity proof",
        "not primary memory substrate"
    ],
    "rows": [
        {
            "object_handle": "RET:first_run:001",
            "provenance_receipt_hash": "aabbccddeeff00112233445566778899",
            "artifact_class": "RET",
            "t_start": 0.0,
            "t_end": 1.0,
            "continuity_status": "Stable",
            "structural_loss_percent": 12.5,
            "upstream_handles": [
                "SPC:first_run:001"
            ],
            "descriptor_vector": {
                "support_strength": "moderate"
            },
            "allowed_use": [
                "support_review",
                "reasoning_overlay_benchmark"
            ],
            "non_claims": [
                "not canon",
                "not source restoration"
            ],
            "source_row_index": 0,
            "source_family": "stable_case"
        }
    ]
}